{"n":905,"encoding":"columnar-int","track":[0,0,0,0,0,0,0,0,0,0,0,0,0,0,0,0,0,0,0,0,0,0,0,0,0,0,0,0,0,0,0,0,0,0,0,0,0,0,0,0,0,0,0,0,0,0,0,0,0,0,0,0,0,0,0,0,0,0,0,0,0,0,0,0,0,0,0,0,0,0,0,0,0,0,0,0,0,0,0,0,0,0,0,0,0,0,0,0,0,0,0,0,0,0,0,0,0,0,0,0,0,0,0,0,0,0,0,0,0,0,0,0,0,0,0,0,0,0,0,0,0,0,0,0,0,0,0,0,0,0,0,0,0,0,0,0,0,0,0,0,0,0,0,0,0,0,0,0,0,0,0,0,0,0,0,0,0,0,0,0,0,0,0,0,0,0,0,0,0,0,0,0,0,0,0,0,0,0,0,0,0,0,0,0,0,0,0,0,0,0,0,0,0,0,0,0,0,0,0,0,0,0,0,0,0,0,0,0,0,0,0,0,0,0,0,0,0,0,0,0,0,0,0,0,0,0,0,0,0,0,0,0,0,0,0,0,0,0,0,0,0,0,0,0,0,0,0,0,0,0,0,0,0,0,0,0,0,0,0,0,0,0,0,0,0,0,0,0,0,0,0,0,0,0,0,0,0,0,0,0,0,0,0,0,0,0,0,0,0,0,0,0,0,0,0,0,0,0,0,0,0,0,0,0,0,0,0,0,0,0,0,0,0,0,0,0,0,0,0,0,0,0,0,0,0,0,0,0,0,0,0,0,0,0,0,0,0,0,0,0,0,0,0,0,0,0,0,0,0,0,0,0,0,0,0,0,0,0,0,0,0,0,1,1,1,1,1,1,1,1,1,1,1,1,1,1,1,1,1,1,1,1,1,1,1,1,1,1,1,1,1,1,1,1,1,1,1,1,1,1,1,1,1,1,1,1,1,1,1,1,1,1,1,1,1,1,1,1,1,1,1,1,1,1,1,1,1,1,1,1,1,1,1,1,1,1,1,1,1,1,1,1,1,1,1,1,1,1,1,1,1,1,1,1,1,1,1,1,1,1,1,1,1,1,1,1,1,1,1,1,1,1,1,1,1,1,1,1,1,1,1,1,1,1,1,1,1,1,1,1,1,1,1,1,1,1,1,1,1,1,1,1,1,1,1,1,1,1,1,1,1,1,1,1,1,1,1,1,1,1,1,1,1,1,1,1,1,1,1,1,1,1,1,1,1,1,1,1,1,1,1,1,1,1,1,1,1,1,1,1,1,1,1,1,1,1,1,1,1,1,1,1,1,1,1,1,1,1,1,1,1,1,1,1,1,1,1,1,1,1,1,1,1,1,1,1,1,1,1,1,1,1,1,1,1,1,1,1,1,1,1,1,1,1,1,1,1,1,1,1,1,1,1,1,1,1,1,1,1,1,1,1,1,1,1,1,1,1,1,1,1,1,1,1,1,1,1,1,1,1,1,1,1,1,1,1,1,1,1,1,1,1,1,1,1,1,1,1,1,1,1,1,1,1,1,1,1,1,1,1,1,1,1,1,1,1,1,1,1,1,1,1,1,1,1,1,1,1,1,1,2,2,2,2,2,2,2,2,2,2,2,2,2,2,2,2,2,2,2,2,2,2,2,2,2,2,2,2,2,2,2,2,2,2,2,2,2,2,2,2,2,2,2,2,2,2,2,2,2,2,2,2,2,2,2,2,2,2,2,2,2,2,2,2,2,2,2,2,2,2,2,2,2,2,2,2,2,2,2,2,2,2,2,2,2,2,2,2,2,2,2,2,2,2,2,2,2,2,2,2,2,2,2,2,2,2,2,2,2,2,2,2,2,2,2,2,2,2,2,2,2,2,2,2,2,2,2,2,2,2,2,2,2,2,2,2,2,3,3,3,3,3,3,3,3,3,3,3,3,3,3,3,3,3,3,3,3,3,3,3,3,3,3,3,3,3,3,3,3,3,3,3,3,3,3,3,3,4,4,4,4,4,4,4,4,4,4,4,4,4,4,4,4,4,4,4,4,4,4,4,4,4,4,4,4,4,4,4,4,4,4,4,4,4,4],"major":[2,2,2,2,2,2,2,2,2,2,2,2,2,2,2,2,2,2,2,2,2,2,2,2,2,2,2,2,2,2,2,2,2,2,2,2,2,2,2,2,2,2,2,2,2,2,2,2,2,2,2,2,2,2,2,2,2,2,2,2,2,2,2,2,2,2,2,2,2,2,2,2,2,2,2,2,2,2,2,2,2,2,2,2,2,2,2,2,2,2,2,2,2,2,2,2,2,2,2,2,2,2,2,2,2,2,2,2,2,2,2,2,2,2,2,2,2,2,2,2,2,2,2,2,2,2,2,2,2,2,2,2,2,2,2,2,2,2,2,2,2,2,2,2,2,2,2,2,2,2,2,2,2,2,2,2,2,2,2,2,2,2,2,2,2,2,2,2,2,2,2,2,2,2,2,2,2,2,2,2,2,2,2,2,2,2,2,2,2,2,2,2,2,2,2,2,2,2,2,2,2,2,2,2,2,2,2,2,2,2,2,2,2,2,2,2,2,2,2,2,2,2,2,2,2,2,2,2,2,2,2,2,2,2,2,2,2,2,2,2,2,2,2,2,2,2,2,2,2,2,2,2,2,2,2,2,2,2,2,2,2,2,2,2,2,2,2,2,2,2,2,2,2,2,2,2,2,2,2,2,2,2,2,2,2,2,2,2,2,2,2,2,2,2,2,2,2,2,2,2,2,2,2,2,2,2,2,2,2,2,2,2,2,2,2,2,2,2,2,2,2,2,2,2,2,2,2,2,2,2,2,2,2,2,2,2,2,2,2,2,2,2,2,2,2,2,2,2,2,2,2,2,2,2,2,2,2,2,2,2,2,2,2,2,2,2,2,2,2,2,2,2,2,2,2,2,2,2,2,2,2,2,2,2,2,2,2,2,2,2,2,2,2,2,2,2,2,2,2,2,2,2,2,2,2,2,2,2,2,2,2,2,2,2,2,2,2,2,2,2,2,2,2,2,2,2,2,2,2,2,2,2,2,2,2,2,2,2,2,2,2,2,2,2,2,2,2,2,2,2,2,2,2,2,2,2,2,2,2,2,2,2,2,2,2,2,2,2,2,2,2,2,2,2,2,2,2,2,2,2,2,2,2,2,2,2,2,2,2,2,2,2,2,2,2,2,2,2,2,2,2,2,2,2,2,2,2,2,2,2,2,2,2,2,2,2,2,2,2,2,2,2,2,2,2,2,2,2,2,2,2,2,2,2,2,2,2,2,2,2,2,2,2,2,2,2,2,2,2,2,2,2,2,2,2,2,2,2,2,2,2,2,2,2,2,2,2,2,2,2,2,2,2,2,2,2,2,2,2,2,2,2,2,2,2,2,2,2,2,2,2,2,2,2,2,2,2,2,2,2,2,2,2,2,2,2,2,2,2,2,2,2,2,2,2,2,2,2,2,2,2,2,2,2,2,2,2,2,2,2,2,2,2,2,2,2,2,2,2,2,2,2,2,2,2,2,2,2,2,2,2,2,2,2,2,2,2,2,2,2,2,2,2,2,2,2,2,2,2,2,2,2,2,2,2,2,2,2,2,2,2,2,2,2,2,2,2,2,2,2,4,2,6,2,4,6,6,6,2,6,4,6,4,6,6,6,4,2,6,6,0,4,4,4,4,2,6,6,4,6,6,0,4,1,4,0,6,6,0,2,6,0,0,6,6,6,6,3,6,6,0,4,4,4,6,0,6,0,6,6,6,6,6,4,4,2,0,4,4,2,0,4,0,4,2,6,2,4,4,4,6,6,4,0,6,6,0,0,2,2,6,4,6,2,4,6,6,6,4,0,4,6,6,6,6,4,6,2,4,2,6,4,6,2,0,4,6,0,6,4,6,6,6,6,2,6,6,6,6,4,4,6,6,6,6,6,6,4,2,6,6,4,6,6,4,4,6,6,0,6,4,5,6,6,0,4,6,6,5,0,6,6,2,6,0,2,6,0,6,6,6,5,2,2,0,6,6,4,2,6,0,6,6,2,0,2,0,0,0,0,0,4,0,4,2,2,5,0,4,6,4,6,6,6,6,4,2,6,6,6,0,2,4,6,4],"cpa":[271,276,331,266,331,295,331,321,295,284,328,316,289,275,297,279,336,322,311,270,308,297,336,289,277,328,309,289,265,292,302,319,274,343,326,277,306,289,334,275,255,276,293,343,336,327,316,290,314,368,340,265,279,266,270,275,279,323,274,325,325,333,298,275,288,267,308,323,323,310,280,325,279,335,291,262,262,279,276,266,300,330,250,324,281,354,350,285,314,311,318,315,360,277,271,325,277,304,256,297,312,362,264,329,265,283,275,304,282,359,356,262,351,349,259,325,270,359,358,319,297,254,263,247,268,296,267,296,277,367,315,335,280,282,310,261,328,254,322,270,303,309,264,331,256,307,310,281,334,300,256,280,315,304,301,279,261,310,330,342,257,350,359,285,317,331,301,297,259,323,302,364,256,305,273,265,290,296,360,304,340,303,319,316,308,341,309,298,314,275,329,262,274,272,263,292,259,282,314,307,347,303,265,279,275,363,276,275,323,321,329,312,357,329,288,307,263,297,311,277,304,329,305,263,285,310,308,296,288,335,347,299,314,346,311,309,356,313,284,323,286,372,330,271,282,288,271,281,245,255,281,269,280,310,313,274,312,243,263,268,286,313,335,339,308,331,314,303,280,313,302,289,251,323,264,260,349,310,286,286,296,305,305,316,341,264,268,291,335,325,300,291,321,328,315,277,246,276,305,300,307,329,297,294,327,342,296,281,293,331,320,291,259,323,331,288,335,333,274,249,276,333,329,293,293,316,352,285,350,336,305,308,277,304,327,342,289,362,256,263,281,340,321,309,353,313,323,319,292,321,297,286,282,330,301,313,304,287,348,319,305,264,197,282,263,236,333,344,251,188,201,248,234,272,176,210,308,280,261,241,243,233,250,254,213,223,212,257,173,223,190,166,331,196,236,293,-1,221,192,252,215,288,337,193,202,263,256,219,207,310,315,316,218,212,187,196,321,243,215,294,244,241,165,229,263,255,201,192,230,236,224,200,262,243,265,269,231,316,286,238,221,305,228,183,271,289,232,238,219,264,193,315,339,244,250,321,245,251,243,192,281,218,264,300,225,181,340,302,264,328,270,229,297,323,196,222,301,262,252,233,225,254,265,252,323,226,267,254,200,254,203,268,253,285,241,334,309,290,235,276,258,167,222,241,258,234,247,317,273,218,288,225,229,201,246,321,187,210,249,234,260,255,224,295,250,262,205,262,242,-1,254,276,289,244,369,231,270,299,263,227,184,237,264,241,264,285,261,308,241,212,178,250,242,221,334,172,232,243,215,244,222,274,262,214,363,255,237,254,296,332,243,244,286,277,241,274,242,244,208,229,227,297,214,284,190,275,329,215,247,258,254,263,277,244,171,295,191,196,179,243,341,278,249,244,197,258,253,282,248,253,245,257,221,290,173,212,231,198,263,226,251,213,196,270,285,197,330,297,223,220,175,241,237,237,249,213,270,222,251,303,262,238,327,216,231,253,225,217,233,246,305,290,177,274,261,229,278,268,209,234,250,240,251,283,234,240,252,231,232,273,259,174,243,255,238,291,174,220,251,242,290,243,249,259,169,205,200,351,237,293,268,348,268,256,259,235,264,277,268,260,306,252,259,309,265,245,301,277,285,322,292,264,252,292,266,307,277,269,302,239,199,307,258,272,264,264,280,290,367,244,249,253,265,321,272,331,315,140,259,310,312,280,227,315,218,280,279,278,283,299,273,245,309,239,309,234,343,270,277,319,259,241,303,242,245,290,231,324,273,234,247,238,320,328,265,251,281,293,311,333,257,293,263,264,275,291,322,255,318,255,260,267,272,278,278,248,279,310,230,292,252,283,260,303,267,212,265,311,150,265,228,257,285,257,290,264,308,310,320,202,329,309,323,315,317,289,237,279,353,232,257,259,318,272,259,336,259,327,289,270,272,346,258,262,280,287,218,359,336,285,272,251,291,271,347,345,282,357,262,330,230,281,360,370,308,258,241,306,361,258,300,311,335,371,328,329,323,336,337,294,323,306,319,352,357,361,281,364,290,257,326,280,358,365,317,356,350,288,338,346,363,350,282,270,335],"cr":[146,146,146,146,146,146,146,146,146,146,146,146,146,146,146,146,146,146,146,146,146,146,146,146,146,146,146,146,146,146,146,146,146,146,146,146,146,146,146,143,143,146,146,146,146,146,146,146,146,146,146,146,146,146,140,146,146,146,146,146,146,146,146,146,146,146,146,146,146,146,146,146,146,146,146,146,146,146,146,146,146,146,146,146,146,146,146,146,146,146,146,146,146,146,146,146,146,146,140,146,146,146,146,146,146,146,146,146,146,146,146,143,146,143,146,146,143,146,146,146,146,146,146,143,146,146,143,146,146,146,146,146,146,146,146,146,146,146,146,146,146,146,146,146,146,146,146,146,146,146,146,146,146,146,146,146,146,146,146,146,146,146,146,146,143,146,130,146,146,146,146,146,140,146,146,146,146,146,146,146,146,146,146,146,146,146,143,146,146,146,146,146,146,128,146,146,143,146,146,146,146,146,146,146,146,146,146,146,146,146,146,146,146,146,146,146,146,146,146,146,146,146,146,146,146,146,146,146,146,146,146,146,146,146,143,146,146,146,146,146,143,146,146,146,146,146,146,143,116,146,146,146,146,146,146,146,146,146,146,146,146,146,146,146,146,146,146,146,146,146,146,146,146,146,126,146,146,146,146,146,146,146,146,146,146,146,146,146,146,146,146,146,146,146,146,146,146,137,146,146,146,146,146,146,146,146,146,146,146,146,146,146,143,146,146,146,146,146,146,143,146,146,146,146,146,146,146,144,146,146,146,146,146,146,146,146,146,146,146,146,146,146,146,146,146,146,146,146,146,143,146,146,146,146,146,146,146,146,146,146,146,146,76,146,146,140,146,146,146,137,76,143,129,141,36,119,146,146,146,146,134,143,143,146,75,113,125,146,130,95,126,66,146,137,144,146,0,131,104,140,138,143,27,40,122,143,146,128,128,146,143,146,146,134,122,134,146,146,143,146,137,146,69,143,146,107,59,85,137,136,131,17,146,146,146,146,137,146,146,143,146,146,133,70,146,146,146,146,146,146,95,146,146,146,146,146,75,98,146,132,146,132,146,146,143,21,146,146,146,146,146,42,143,146,65,140,146,146,121,137,75,139,143,146,146,48,146,146,124,146,63,146,146,138,146,146,146,146,146,146,143,36,132,146,146,143,143,146,146,146,146,129,146,105,146,146,54,146,146,87,146,146,123,146,146,146,33,146,140,0,146,146,143,146,146,137,146,146,146,131,34,146,146,146,146,146,143,146,146,144,65,137,84,146,146,85,141,132,67,72,135,132,146,123,146,137,135,146,146,146,134,17,146,146,146,146,134,143,117,140,134,143,143,146,77,146,146,128,140,143,140,146,146,146,29,146,91,67,29,63,146,140,146,146,63,146,143,144,139,143,11,134,137,143,11,127,146,141,146,134,146,137,67,140,146,103,146,146,143,143,48,146,140,118,146,146,146,113,146,143,146,146,146,139,138,146,134,143,131,134,146,146,37,146,146,140,146,146,146,143,146,93,146,146,143,146,146,146,140,143,146,31,146,146,141,146,46,43,121,146,146,146,146,146,76,113,126